factory_name,factory_type,factory_priority,management_employees,number_of_machines,production_capacity_yearly_in_dozen,principal_exportable_products,factory_location,factory_location_in_city,factory_location_in_town,year_of_establishment,factory_status
"Ettadee Jeans Ltd.",Woven,5,1720,930,360000,"Pants ,Trousers ,Bermuda ,Shorts","1670/2091, West Sholashahar, Building # 3, Chittagong, Baizid",Chittagong,"Bayzid Bostami",2007,Clean
"Euro Apparels Ltd.",Woven,5,320,214,42000,"Jackets ,Ladies Items ,Jogging Suits ,Trousers","923, K.B. Dovash Lane, Chittagong, Goshaildanga",Chittagong,Goshaildanga,1993,Clean
"Euro Arte Apparels Ltd.",Woven,5,600,319,124800,"Shirts ,Pants ,Jacket","Plot # 346, Kabirpur, Ashulia, Dhaka, Savar",Dhaka,Savar,2013,Clean
"Euro Jeans Ltd.",Woven,5,600,240,104000,"Shirts ,Jackets ,Pants","Chowdhury Bari, Gazipur, Vogra",Gazipur,Vogra,2007,Clean
"Euro Knit Wear Ltd.",Knit,5,596,254,550000,"Shirts ,Pants ,T-Shirts ,Polo Shirts","Chowdhury Bari, Gazipur, Vogra",Gazipur,Vogra,2016,Clean
"Euro-Mart Apparels Ltd.",Knit,5,110,65,72000,"Fleece Jackets ,T-Shirts ,Polo Shirts","House # 1 (4th & 5th Floor), Road # 1, Block- B, Section # 12, Dhaka, Mirpur",Dhaka,Mirpur,1998,Clean
"Euroasia felt Industries Ltd.",Woven,5,180,40,8000,"Shirts ,Pants","Gobindabari, Sardagonj, Gazipur, Kashimpur",Gazipur,Kashimpur,2016,Clean
"European Pantalon Fashion Ltd.",Woven,5,250,52,26000,"Shirts ,Pants","Chaydana, K.B. Bazar, National University, Gazipur, National University",Gazipur,"National University",2012,Clean
"Eurotex Knitwear Ltd.",Knit,5,640,194,390000,"Shirts ,Pants ,T-Shirts ,Polo Shirts","Nayamati, Kutubpur, Narayanganj, Fatullah",Narayanganj,Fatullah,2014,Clean
"Eurozone Fashion Ltd.",Woven,5,2200,723,150000,"Jackets ,Pants ,Trousers ,Cargo","Ka-189/3, Jamaz Road, Joar Shahara, Dhaka, Dhaka",Dhaka,Dhaka,2006,Clean
"Eutex Fashion Limited",Woven,1,2,60,1200000,"Shirt ,Pant ,T-Shirt ,Polo Shirt","Khagan, Birulia, Savar, Dhaka, Dhaka",Dhaka,Dhaka,2023,Clean
"Eva Sweater Ltd.",Sweater,5,3000,1250,120000,"Sweaters ,Jumpers ,Pullovers ,Cardigans","Plot # 269, Gazipur, Choydana",Gazipur,Choydana,2002,Clean
"Evana Garments Ltd.",Woven,5,190,110,288000,"Padded Jackets ,Long Pants ,Tousers","House # 4, Road # 132, Gulshan South C/A, Dhaka, Gulshan-1",Dhaka,Gulshan-1,1985,Clean
"Eve Dress-Shirts Ltd.",Woven,5,784,364,156000,"Shirts ,Ladies Shirts ,Children Wears","Ashulia, Dhaka, Savar",Dhaka,Savar,2005,Clean
"Eve Garments Ltd.",Woven,5,490,269,156000,"Shirts ,Ladies Blouses","House # 7, Road # 20, Dhaka, Gulshan-1",Dhaka,Gulshan-1,1985,Clean
"Ever Fashion Ltd.",Knit,5,255,201,2196000,"Mans T-Shirts ,Girls Rib Vest ,Boys Tight Boxer","Fuji Trade Centre (9th & 10th Floor), Cha-87/C & 87/2, Pragati Sarani, Dhaka, Dhaka",Dhaka,Dhaka,1993,Clean
"Ever Fashion Tongi Ltd.",Knit,5,1857,792,28800000,"Ladies Underwear ,Girls Crops Bra ,Girls Cami","Plot # D-204, 205 & 206, BSCIC I/A, Gazipur, B. Baria",Gazipur,"B. Baria",2012,Clean
"Everbright Sweater Ltd.",Sweater,1,1400,600,420000,"Sweaters ,Pullovers ,Cardigans","Kathgora Bazar, Zirabo, Dhaka, Dhaka",Dhaka,Dhaka,2019,Clean
"Everest Sweaters Ltd.",Sweater,5,580,445,54000,"Sweaters ,Pullovers ,Cardigans ,Jumpers","M.H. Building, 15, Strand Road, Chittagong","M.H. Building, 15, Strand Road",Chittagong,1998,Clean
"Evergreen Sweaters Ltd.",Sweater,5,800,480,72000,Sweaters,"Choydana, Gazipur, Joydevpur",Gazipur,Joydebpur,1998,Clean
"Evernal Industry Ltd.",Sweater,5,1280,750,1200000,Sweaters,"3/4-A, Darail, Sharaish, Gazipur, Tongi",Gazipur,Tongi,2005,Clean
"Evertop Product Development Co. Ltd.",Woven,1,570,1984,160000,"Shirt ,Pant ,T-Shirt ,Polo Shirt","Plot # 6b, Korean EPZ, Karnafully, Chittagong, Chittagong",Chittagong,Chittagong,2022,Clean
"Evince Dress Shirts Ltd.",Woven,5,647,356,150000,Shirts,"Plot # 33, Section # 7, Dhaka, Mirpur",Dhaka,Mirpur,2000,Clean
"Evince Garments Ltd.",Woven,5,861,511,185000,"Shirts ,Boy's Shirts","Plot # 33, Section # 7, Dhaka, Mirpur",Dhaka,Mirpur,1985,Clean
"Evince Limited.",Woven,5,175,250,78000,Shirts,"Plot # 33, Section # 7, Dhaka, Mirpur",Dhaka,Mirpur,1992,Clean
"Evitex Apparels Ltd.",Woven,5,824,480,234000,Shirts,"Shirir Chala, Bhabanipur, Gazipur, Joydevpur",Gazipur,Joydebpur,2006,Clean
"Evitex Dress Shirt Ltd.",Woven,5,500,386,70000,"Shirts ,Pants","Shirir Chala, Bhabanipur, Gazipur, Joydevpur",Gazipur,Joydebpur,2013,Clean
"Evitex Fashions Ltd.",Woven,5,750,379,182000,Shirts,"Shirir Chala, Bhabanipur, Gazipur, Joydevpur",Gazipur,Joydebpur,2004,Clean
"Ewings Garments & Textiles Ltd.",Knit,5,122,55,450000,"T-Shirts ,Polo Shirts ,Tank Tops","Plot # 101/102 (2nd Floor), BSCIC I/E, Gazipur, Konabari",Gazipur,Konabari,2008,Clean
"Excel Apparels Ltd.",Woven,5,450,200,78000,"Shirts ,Blouses","91, Tongi I/A (1st & 2nd Floor), Gazipur, Tongi",Gazipur,Tongi,1985,Clean
"Excel Industries Ltd.",Woven,5,550,301,46800,"Jogging Sets ,Trousers ,Jackets ,Pants","1414/A Khilgoan, Dhaka, Khilgaon",Dhaka,Khilgaon,1992,Clean
"Excellent Attire Ltd.",Woven,5,292,152,50000,"Shirts ,Jackets ,Pants ,Trousers","Dewanbari, North Kashipur, Fatullah, Narayanganj-1400, Narayanganj, Narayangonj",Narayanganj,Narayanganj,2005,Clean
"Excellent Sweater Ltd.",Sweater,5,658,350,75000,Sweaters,"193/195, Bengal Plaza, Jamgora, Uttar Gazirchat, Ashulia, Dhaka, Savar",Dhaka,Savar,2012,Clean
"Excelsior Garments Ltd.",Woven,5,345,154,90000,"Shirts ,Blouses ,Shorts","Dag-1098, Road # 9/C, Sector # 5, Ahalia, Dhaka, Turag",Dhaka,Turag,1986,Clean
"Excom Fashions Ltd.",Woven,5,600,334,160000,"Shirts ,Boxers ,Payjama","Nimertec, Rajfullbariya, Dhaka, Savar",Dhaka,Savar,2007,Clean
"Executive Attire Ltd.",Woven,5,1500,278,160000,"Shirts ,Pants","Habirbari, Mymensingh, Valuka",Mymensingh,Valuka,2016,Clean
"Executive Greentex Ltd.",Knit,1,3031,1213,1500000,,"Molaed, Sreepur, Gazipur, Gazipur",Gazipur,Gazipur,2019,Clean
"Executive Hi-Fashions Ltd.",Knit,1,1778,746,1105000,"T-Shirts ,Polo Shirts","Sirirchala, Bhabanipur, Gazipur, Gazipur",Gazipur,Gazipur,2018,Clean
"Executive Intimates Ltd.",Knit,5,1509,975,375000,"T-Shirts ,Polo Shirts","Gilarchala, Gazipur, Sreepur",Gazipur,Sreepur,2016,Clean
"Exensive Fashion Ltd.",Woven,5,500,357,400000,Pants,"Raj Fulbaria, Dhaka, Savar",Dhaka,Savar,2012,Clean
"Experience Clothing Co. Ltd.",Woven,5,2986,2300,550000,"Ladies Pants ,Skirts ,Blouses ,Shorts","Plot # 72 & 82, Ganakbari, DEPZ, Dhaka, Savar",Dhaka,Savar,1996,Clean
"Expo Dress Ltd.",Woven,5,400,172,84000,"Shirts ,Trousers, Pants","Holding # 1/A (1st floor), Section # 7, Dhaka, Mirpur",Dhaka,Mirpur,1994,Clean
"Expo Knitwears Ltd.",Knit,1,131,120,5700,"T-Shirt ,Polo Shirt","Kha-51/3, Road # 5, Tanpara, Khilkhet, Dhaka, Dhaka",Dhaka,Dhaka,2021,Clean
"Export Connection Ltd.",Woven,5,200,100,60000,"Shirts ,Blouses ,Trousers ,Pajama sets","1/1 A & 1/1 B, Ring Road, Dhaka, Shamoli",Dhaka,Shamoli,1992,Clean
"Export Knitwear Ltd.",Woven,5,590,270,90000,"Sports Wear ,Trousers ,Skirts ,Shorts","Sena Kalyan Comm. Complex (4th Floor), Plot # 9, Block-F, Gazipur, Tongi",Gazipur,Tongi,1991,Clean
"Exsaco Ltd.",Woven,1,2901,0,200000,,"Domna, Dokkhinbaroibari, Kashimpur, Gazipur, Gazipur",Gazipur,Gazipur,2017,Clean
"F & P Apparels Ltd.",Knit,5,218,88,250000,"T-Shirts ,Polo Shirts","2/2A, Safura Market, Aouchpara, Mukterbari Road, Gazipur, Tongi",Gazipur,Tongi,2010,Clean
"F M Fashion Wear",Woven,1,1,150,16800,"Shirt ,Pant ,T-Shirt ,Polo Shirt","M-4/2, Road # 27, Block # M, Eastern Housing, Pallabi, Mirpur, Dhaka, Dhaka",Dhaka,Dhaka,2022,Clean
"F.B. Fashion (Pvt) Ltd.",Sweater,5,880,603,58000,"Cardigans ,Pullovers ,Jersey ,Poncho","Khailkur, National University, Gazipur, Board Bazar",Gazipur,"Board Bazar",2004,Clean
"F.F. Apparels Ltd.",Sweater,5,350,300,36000,Sweaters,"House # 27, Road # 2, O.R. Nizam Road, GEC Circle, Chittagong","House # 27, Road # 2, O.R. Nizam Road, GEC Circle",Chittagong,1993,Clean
"F.M. Fashion Wear Ltd.",Woven,5,275,165,100000,"Jackets ,Children Wears ,Overalls","457 DIT Road, West Rampura, Dhaka, Rampura",Dhaka,Rampura,1984,Clean
"Fabric Touch And Design Ltd.",Knit,5,256,249,240000,"T-Shirts ,Polo Shirts","Hatimara, Gazipur, Kashimpur",Gazipur,Kashimpur,2015,Clean
"Fabrica Knit Composite Ltd.",Knit,1,2900,1100,1800000,"T-Shirts ,Polo Shirts ,Mens Shorts ,Shirts","Bashaid, Ashulia, Savar, Dhaka, Bangladesh, Dhaka, Dhaka",Dhaka,Dhaka,2019,Clean
"Fabulous Fashions Ltd.",Sweater,5,500,400,100000,Sweaters,"Plot # 15-16, Road # 4, Section # 7, Dhaka, Mirpur",Dhaka,Mirpur,2002,Clean
"Fahami Apparels Ltd.",Woven,5,589,402,100000,"Jackets ,Overalls ,Pants ,Trousers","Fahami Complex, 113, Baipail, Dhaka, Savar",Dhaka,Savar,2000,Clean
"Fahami Dresses Ltd.",Woven,5,549,660,50000,"Shirts ,Jackets ,Pants ,Trousers","Fahami Complex, 113, Baipail, Dhaka, Savar",Dhaka,Savar,2006,Clean
"Fahami Industries Ltd.",Woven,5,1602,1568,125000,"Shirts ,Jackets ,Pants ,T-Shirts","Fahami Complex, 113, Baipail, Dhaka, Savar",Dhaka,Savar,2005,Clean
"Fahami Knitwear Ltd.",Knit,5,661,339,150000,"T-Shirts ,Polo Shirts ,Trousers ,Shorts","Fahami Complex, 113, Baipail, Dhaka, Savar",Dhaka,Savar,2005,Clean
"Fahami Shirts Ltd.",Woven,5,540,829,150000,"Shirts ,Coats ,Coveralls ,Overalls","Fahami Complex, 113, Baipail, Dhaka, Savar",Dhaka,Savar,2006,Clean
"Fahami Trousers Ltd.",Woven,5,1300,700,375000,"Shirts ,Trousers ,Pants","113, Baipail, Dhaka, Savar",Dhaka,Savar,2010,Clean
"Fahim Attire And Composite Ltd.",Knit,5,350,160,240000,"T-Shirts ,Polo Shirts ,Fleece Jackets ,Pants","Kamarjuri, Barari Para, National University, Gazipur, Joydevpur",Gazipur,Joydebpur,2008,Clean
"Fahim Textile Mills Ltd.",Woven,5,220,115,60000,"Home Textile ,Eyelet Curtain ,Pillow Case","Barabo, Tarabo, Narayanganj, Rupganj",Narayanganj,Rupganj,2011,Clean
"Fahima Knit Fashion Ltd.",Knit,5,143,75,117000,"T-Shirts ,Polo Shirts","Mir Jakir Complex, Block # B, Holding # 409, Naljani, Gazipur, Joydevpur",Gazipur,Joydebpur,2014,Clean
"Fair Apparels Ltd.",Knit,5,1000,300,300000,"T-Shirts ,Polo Shirts ,Sweat Shirts ,Tank Top","A/28-29, BSCIC Inds. Estate, Narayanganj, Fatullah",Narayanganj,Fatullah,2000,Clean
"Fair Tex Sweater Ltd.",Sweater,5,370,250,50000,Sweater,"Haji Kafiluddin Plaza (4th Floor), Dagerchala, Gazipur, National University",Gazipur,"National University",2015,Clean
"Fair Textile Mills Ltd.",Woven,1,350,800,1800000,"Shirt ,Pant ,T-Shirt ,Polo Shirt","Golakandail, Vulta, Narayanganj, Narayangonj",Narayanganj,Narayanganj,2022,Clean
"Fair Washing Ltd.",Woven,5,1553,1135,1000000,Jackets,"East Chandura, Kaliakoir, Gazipur, Shafipur",Gazipur,Shafipur,2006,Clean
"Fairmonde Knitting Ltd.",Woven,5,180,79,60000,"Wind Pants ,Wind Jackets ,Shorts","68/X, Sagarica Road, Chittagong, Pahartoli",Chittagong,Pahartoli,2001,Clean
"Faiyaz Apparel Ltd.",Woven,5,404,179,120000,"Men's Shirts ,Girls Blouses","888 Shewrapara, Rokeya Sharani, Dhaka, Mirpur",Dhaka,Mirpur,1992,Clean
"Faiza Industries Ltd.",Woven,5,350,251,625000,"Shirts ,Pants","Bymile, Konabari, Gazipur, B. Baria",Gazipur,"B. Baria",2016,Clean
"Faiza Sweater Ltd.",Sweater,5,720,450,50000,"Sweaters ,Cardigans","Bhason Sarak, Gazipur, Adhepasa",Gazipur,Adhepasa,2011,Clean
"Fakhruddin Textile Mills Ltd.",Knit,5,7713,2170,173340,"T-Shirt ,Polo Shirt ,Tank Top ,Pant","Kewa, Ghorgaria, Master Bari, Gazipur, Gazipur",Gazipur,Gazipur,2008,Clean
"Fakir Apparels Ltd.",Knit,5,2500,835,1300000,"T-Shirts ,Polo Shirts ,Trousers ,Tank Tops","A-127-131, 135-138, 142-145, B-501-503, BSCIC Hosiery Shilpa Nagari, Shashangaon, Narayanganj, Fatullah",Narayanganj,Fatullah,2001,Clean
"Fakir Eco-Knitwears Ltd.",Woven,1,1200,795,631250,,"Kayempur, Fatullah, Narayanganj, Narayanganj, Narayangonj",Narayanganj,Narayanganj,2021,Clean
"Fakir Knitwears Ltd.",Knit,5,7000,3000,5000000,"T-Shirts ,Polo Shirts ,Tank Tops","Kayempur, Narayanganj, Fatullah",Narayanganj,Fatullah,2004,Clean
"Falcon Int'l Knit Composite",Knit,5,699,297,400000,"T-Shirts ,Polo Shirts ,Trousers","Plot # 2/1 (Basement, Ground, 1st Fl), Road # 7, Nobodoy Housing Society, Dhaka, Mohammadpur",Dhaka,Mohammadpur,1999,Clean
"Falcon International",Knit,5,725,518,420000,"T-Shirts ,Polo Shirts ,Shorts ,Trousers","Plot # 2/1 (2nd, 3rd & 4th Floor), Road # 7, Nobodoy Housing Society, Dhaka, Mohammadpur",Dhaka,Mohammadpur,1989,Clean
"Faltex Composite Ltd.",Knit,5,520,240,0,"T-Shirts ,Polo Shirts","Plot # B/18, BSCIC I/E, Gazipur, Tongi",Gazipur,Tongi,2010,Anomaly
"Fame Composite Ltd.",Knit,5,176,120,62500,"T-Shirts ,Polo Shirts","Dakshin, Panishail, Gazipur, Kashimpur",Gazipur,Kashimpur,2012,Clean
"Fame Design Ltd.",Knit,5,650,220,599000,"T-Shirts ,Polo Shirts","Plot # A-115/116, BSCIC, Hosiery Shilpanagary, Narayanganj, Fatullah",Narayanganj,Fatullah,2014,Clean
"Fame Knitwears Ltd.",Sweater,5,400,205,68880,Sweaters,"Haji Kujrat Ali Mollah Super Market, 1 Harunabad, Pallabi, Dhaka, Mirpur",Dhaka,Mirpur,1993,Clean
"Fame Sweaters Ltd.",Sweater,5,0,440,0,Sweaters,"Darail, Sataish, Gazipur, Tongi",Gazipur,Tongi,2003,Anomaly
"Familiar Limited",Knit,5,482,300,750000,"Children Wears ,Polo Shirts ,Bottom Wears","South Panisile, Gazipur, Kashimpur",Gazipur,Kashimpur,2003,Clean
"Family Style Garments Ltd.",Woven,5,280,160,130000,"Shirts ,Trousers ,Pants ,Skirts","East Delpara, Narayanganj, Fatullah",Narayanganj,Fatullah,1992,Clean
"Familytex (BD) Ltd.",Knit,5,2000,1641,30000,"Sweater ,Woven Bottoms ,Knit Top","Plot # 47 - 48, Road # 5, Sector # 4, Chittagong, CEPZ",Chittagong,CEPZ,2007,Clean
"Famous Design Ltd.",Knit,5,389,126,130000,"Shirts ,Pants ,T-Shirts ,Polo Shirts","246/1/F, West Agargaon, Sher-E-Bangla Nagar, Dhaka, Sher-E-Bangla Nagar",Dhaka,"Sher-E-Bangla Nagar",2011,Clean
"Fancy Fashion Sweaters Ltd.",Sweater,5,2100,1324,200000,"Sweaters ,Pullovers ,Cardigans ,Tank Tops","1153-54, Shahid Siddique Road, Khailkur, Gazipur, Gazipur",Gazipur,Gazipur,1998,Clean
"Far East Knitting & Dyeing Ind. Ltd.",Knit,5,850,225,400000,"Ladies Dresses ,T-Shirts","15/1, Shahid Nazrul Islam Road, Hatkhola, Dhaka, Dhaka",Dhaka,Dhaka,1994,Clean
"Faraz Fabrics (Pvt.) Ltd.",Woven,5,400,200,48000,"Jackets ,Skirts ,Overalls ,Jumpers","140, Dewanhat, 2nd Rail Gate, Chittagong","140, Dewanhat, 2nd Rail Gate",Chittagong,1994,Clean
"Fareast Dresses Ltd.",Woven,5,300,494,120000,"Shirts ,Ladies Blouses ,Skirts","1/11, Ahmed Nagar, Section # 2, Dhaka, B. Baria",Dhaka,"B. Baria",2004,Clean
"Farha Apparels Ltd.",Woven,5,150,120,0,"Jackets ,Pants","1-D, 1-20 Kolwala Para, Section # 1, Dhaka, Mirpur",Dhaka,Mirpur,1991,Anomaly
"Farida Fashion Sweater Ltd.",Sweater,5,310,300,40000,Sweaters,"Islam Mansion (5th Floor), 6606(P) South Halishahar, Near EPZ Gate, Chittagong, Bandar",Chittagong,Bandar,2004,Clean
"Farida Garments (Pvt.) Ltd.",Knit,5,400,150,130000,"T-Shirts ,Polo Shirts","A/79, BSCIC I/A, Sasongaon, Narayanganj, Fatullah",Narayanganj,Fatullah,2014,Clean
"Fariha Knit Tex Ltd.",Knit,5,950,405,600000,"T-Shirts ,Polo Shirts ,Jackets ,Pants","Baroibog, Enayat Nagar, Narayanganj, Fatullah",Narayanganj,Fatullah,2002,Clean
"Farisha Composite Knitwear Ltd.",Knit,5,645,313,700000,"T-Shirts ,Polo Shirts ,Tank Top","352, Konabari, Nilnagar, Gazipur, Gazipur Sadar",Gazipur,"Gazipur Sadar",2012,Clean
"Farmin Fashion Design Ltd.",Woven,5,450,220,100000,"Trousers ,Jogging Suits ,Shorts ,Jackets","154, Kamrabad, Aturer Depot, Chittagong, Aturar Depot",Chittagong,"Aturar Depot",2004,Clean
"Farmin Apparels Limited",Woven,5,450,200,105000,"Trousers ,Jogging Suits ,Shorts ,Jackets","154, Kamrabad, Aturar Depot, Chittagong, Aturar Depot",Chittagong,"Aturar Depot",1995,Clean
"Farmin Fashion Design Ltd.",Woven,5,450,220,100000,"Trousers ,Jogging Suits ,Shorts ,Jackets","154, Kamrabad, Aturer Depot, Chittagong, Aturar Depot",Chittagong,"Aturar Depot",2004,Clean
"Farnoor Garments Ltd.",Knit,5,630,382,150000,"Trousers ,Jackets ,T-Shirts ,Polo Shirts","1028/1/2, Malibagh Bazar Road, Dhaka, Malibagh",Dhaka,Malibagh,1995,Clean
"Farseeing Knit Composite Ltd.",Knit,5,750,600,12500,"T-Shirts ,Polo Shirts","Faridpur, Telihat, Gazipur, Sreepur",Gazipur,Sreepur,2009,Clean
"Farshe Dyeing Ltd.",Sweater,5,2200,992,1385000,Sweaters,"Harinchala, Konabari, Gazipur, Joydevpur",Gazipur,Joydebpur,2007,Clean
"Farzana Fashions World Ltd.",Knit,5,270,115,500000,"T-Shirts ,Polo Shirts ,Briefs ,Bikini","Nur Complex, N-224, Dighirpar, Chittagong, Dewanhat",Chittagong,Dewanhat,2011,Clean
"Fashion 2000 Ltd.",Woven,5,1325,623,20000,"Blouses ,Trousers","367/1, Senpara Parbata, (8th Floor), Dhaka, Mirpur",Dhaka,Mirpur,2002,Clean
"Fashion Apparel Industries",Knit,5,320,290,60000,"Dress Shirts","FIDC Road, BSCIC I/A, Chittagong","FIDC Road, BSCIC I/A,",Chittagong,1993,Clean
"Fashion Asia Ltd.",Knit,5,641,374,250000,"Fleece Jackets ,T-Shirts ,Polo Shirts","Holding # 4/2-A (4th & 5th Floor), Mouza # 135, Gopalpur, Monnu Nagar, Gazipur, Tongi",Gazipur,Tongi,2000,Clean
"Fashion Craft Design Ltd.",Woven,5,250,110,60000,"Shirts ,Pants ,Trousers","Beron, Zirabo, Ashulia, Dhaka, Savar",Dhaka,Savar,2011,Clean
"Fashion Craft Knit Wear Ltd.",Knit,5,250,110,300000,"Denim Jackets ,Denim Pants ,Twil Pants","Beron, Zirabo, Ashulia, Dhaka, Savar",Dhaka,Savar,2001,Clean
"Fashion Craft Ltd.",Woven,5,500,270,45000,"Jackets ,Pants ,Swim Wears ,Trousers","A/3 BSCIC I/A, Sagarica Road, Chittagong, Pahartali",Chittagong,Pahartoli,1996,Clean
"Fashion Create Apparels Ltd.",Knit,5,250,100,48000,"Shirts ,T-Shirts ,Shorts","1248/1249, D.T. Road, Dhaniala Para, Chittagong, Double Mouring",Chittagong,"Double Mooring",2002,Clean
"Fashion Enterprise",Woven,5,500,300,75000,"Shirts ,Pants ,Jackets ,Skirts","Plot # 4, Avenue # 1, Section # 7, Dhaka, Mirpur",Dhaka,Mirpur,1992,Clean
"Fashion Export International Ltd.",Knit,5,450,225,40000,"Jackets ,T-Shirts ,Pants ,Bath Robe","Jiban Bhaban, 435/A, Sadrghat Road, Chittagong, Sadarghat",Chittagong,Sadarghat,1998,Clean
"Fashion Exposure Ltd.",Sweater,5,998,424,60000,Sweaters,"Elias Tower, 4 Harunabad, Section # 12, Dhaka, Mirpur",Dhaka,Mirpur,1998,Clean
"Fashion Fair Ltd.",Woven,5,200,95,84000,"Jackets ,Pants ,Knit Items","1956/A, Airport Road, South Halishahar, Chittagong, Bandar",Chittagong,Bandar,1995,Clean
"Fashion Fiber Limited",Sweater,5,61,80,5000,Sweaters,"Jarun, Kashim Cotton Mill, Gazipur, B. Baria",Gazipur,"B. Baria",2012,Clean
"Fashion Flash Ltd.",Woven,5,917,500,200000,"Trousers ,Skirts","149, Azampur, Shah Kabir Mazar Road, Dhaka, Dhaka",Dhaka,Dhaka,2007,Clean
"Fashion Flow Apparels Ltd.",Woven,1,855,688,243000,"Shirt ,Pant ,Jacket ,Trouser","Plot # 559-560, Vannara, Mouchak, Kaliakoir, Gazipur, Gazipur",Gazipur,Gazipur,2017,Clean
"Fashion Forum Ltd.",Woven,5,3500,1737,42000,"Shirts ,Pants","367/1, Senpara Parbata, Section # 10, Dhaka, Mirpur",Dhaka,Mirpur,2000,Clean
"Fashion Fx Ltd.",Knit,5,175,78,1000000,"T-Shirts ,Polo Shirts","Harbaid, Pubail, Gazipur, Gazipur Sadar",Gazipur,"Gazipur Sadar",2008,Clean
"Fashion Gears Ltd.",Knit,5,1200,650,216000,"Jackets ,Pants ,T-Shirts","Jharna Complex, Soydana, Malekerbari,National University, Gazipur, Board Bazar",Gazipur,"Board Bazar",2000,Clean
"Fashion Globe Denim Wear Ltd.",Woven,1,600,562,1015166,"Shirt ,Pant ,Jacket ,Trouser","Plot # C-160 & B- 178, Bscic Industrial Area, Tongi, Gazipur, Gazipur",Gazipur,Gazipur,2023,Clean
"Fashion House (Southern) Ltd.",Woven,5,1150,450,300000,"Shirts ,Blouses","Bara Rangamatia, Ashulia, Dhaka, Savar",Dhaka,Savar,1989,Clean
"Fashion Innovation Ltd.",Woven,5,665,272,105000,"Shirts ,Trousers ,T-Shirts ,Pants","Shah Khartail Complex, Khartail, Shataish, Gazipur, Tongi",Gazipur,Tongi,2003,Clean
"Fashion Jeans Ltd.",Woven,5,650,190,125000,"Shirts ,Trousers ,Pants","149/150, Azampur, Shah Kabir Mazar Road, Dhaka, Uttara",Dhaka,Uttara,2011,Clean
"Fashion Knit Garments Ltd.",Knit,5,650,317,300000,"Children Wears ,Ladies Tops","Holding # 4 (2nd Floor), Cornapara, Dhaka, Savar",Dhaka,Savar,1998,Clean
"Fashion Linkers Ltd.",Woven,5,400,220,70000,"Jackets ,Trousers ,Pants","31, DIT Road (4th & 5th Fl), Malibagh Chowdhury Para, Dhaka, Malibagh",Dhaka,Malibagh,1994,Clean
"Fashion Makers Ltd.",Knit,5,350,150,250000,"T-Shirts ,Polo Shirts ,Sweat Shirts","Gargaria Master Bari, Kewa, Gazipur, Sreepur",Gazipur,Sreepur,1993,Clean
"Fashion Network Ltd.",Knit,5,500,300,150000,"Shirts ,Ladies Dress ,Children Wears ,Jackets","6, Shingbari Road, Boro Dewra, Gazipur, Tongi",Gazipur,Tongi,1993,Clean
"Fashion of Wales Ltd.",Knit,5,450,250,120000,"Shirts ,Pants ,T-Shirts ,Panties","Plot # C/28/29 (3rd - 5th Floor), BSCIC I/A, Sagarika Road, Chittagong","Plot # C/28/29 (3rd - 5th Floor), BSCIC I/A, Sagarika Road",Chittagong,2009,Clean
"Fashion Park Int'l Ltd.",Knit,5,330,160,70000,"Fleece Jackets ,T-Shirts ,Trousers","Hajee Faiz Mansion, 191/192, Lalchand Road, Chittagong","Hajee Faiz Mansion, 191/192, Lalchand Road",Chittagong,1998,Clean
"Fashion Plus Ltd.",Woven,5,240,105,40000,"Shirta ,Jackets ,Pants","151/8, Green Road, Dhaka, Dhanmondi",Dhaka,Dhanmondi,2005,Clean
"Fashion Point Ltd",Knit,5,645,306,468000,"T-Shirts ,Polo Shirts ,Sweat Shirts ,Pants","Plot # S-41-42, BSCIC Industrial Estate, Konabari, Gazipur, Gazipur",Gazipur,Gazipur,2000,Clean
"Fashion Products Ltd.",Knit,5,575,255,120000,"Children Wears ,Active Wears ,Jackets ,Trousre","79, Agrabad C/A, Jahan Building No. 3, Chittagong","79, Agrabad C/A, Jahan Building No. 3",Chittagong,1994,Clean
"Fashion Skirt & Trousers Ltd.",Woven,5,488,279,35100,"Trousers ,Skirts","Choydana, Gazipur, K.B. Bazar",Gazipur,"K.B. Bazar",1996,Clean
"Fashion Step Ltd.",Woven,5,1660,1250,468000,"Shirts ,Pants ,Boys Shirt ,Blouse","16/3, Shataish, Tilagati Road, Gazipur, Gazipur",Gazipur,Gazipur,2013,Clean
"Fashion Store Ltd.",Woven,5,250,130,45000,"Wind Breakers ,Jogging Suits ,Long Pants","81, Kalmessar, Jalal Shopping Complex (3rd-5th Floor), Gazipur, Board Bazar",Gazipur,"Board Bazar",2007,Clean
"Fashion Summit Ltd.","Knit Composite",1,365,349,350000,"T-Shirt ,Polo Shirt ,Pullover ,Jacket","Plot # S-18, BSCIC I/E, Konabari, Gazipur, Gazipur",Gazipur,Gazipur,2019,Clean
"Fashion Toys Ltd.",Woven,5,450,300,40000,"Trousers ,Jackets ,Bra","39, Imandipur, Dhaka, Savar",Dhaka,Savar,1994,Clean
"Fashion Trade",Woven,1,1,81,184000,"Shirt ,Pant","589/1, Shah Kabir Mazar Road, Uttarkhan, Dhaka, Dhaka",Dhaka,Dhaka,2022,Clean
"Fashion Trousers Ltd.",Woven,5,757,371,32400,"Trousers ,Shorts","Chaydana, Gazipur, Gazipur",Gazipur,Gazipur,1989,Clean
"Fashion Watch Ltd.",Woven,5,350,250,0,"Jackets ,Trousers","1293, D.T Road, Dhanialaoara, Chittagong","1293, D.T Road, Dhanialaoara",Chittagong,2003,Anomaly
"Fashion Zone Ltd.",Woven,5,320,133,72000,Shirts,"22, Bijoy Nagar (3rd floor), Dhaka, Dhaka",Dhaka,Dhaka,1992,Clean
Fashion-1,Woven,1,1,149,1000000,"Shirt ,Pant ,T-Shirt ,Polo Shirt","Holding # 40/4, Shataish, Tongi, Gazipur, Gazipur",Gazipur,Gazipur,2022,Clean
"Fashion.Com Limited",Woven,5,450,350,48000,"Jackets ,Pants ,Skirts","Durgapur, Ashulia, Dhaka, Savar",Dhaka,Savar,2012,Clean
"Fashions Designs Ltd.",Knit,5,300,145,50000,"T-Shirts ,Polo Shirts","Rahmat Tower, Chandona Chowrasta, Gazipur, Joydevpur",Gazipur,Joydebpur,2011,Clean
"Fashions Mart Ltd.",Woven,5,190,112,36000,"Blouses ,Jackets ,Trousers","Plot # 1/1, 1/3, Block - K, Section # 1, Dhaka, Mirpur",Dhaka,Mirpur,2001,Clean
"Fashions Suits And Trousers Ltd.",Woven,5,614,291,22400,"Blazers ,Trousers ,Suits ,Shorts","Chandona, Gazipur, Gazipur",Gazipur,Gazipur,1997,Clean
"Fashions Support Ltd.",Knit,5,550,401,500000,"T-Shirts ,Pants","Baniarchala, Bhabanipur, Gazipur, Gazipur Sadar",Gazipur,"Gazipur Sadar",2013,Clean
"Fashrobe Garments Ltd.",Woven,5,499,193,120000,"Shirts ,Ladies Blouses ,Children Wears","Malibag Super Market (2nd floor), 468 DIT Road, Dhaka, Malibagh",Dhaka,Malibagh,1985,Clean
"Fast Jacquard Industries Ltd.",Sweater,5,200,100,65000,Sweater,"Bashon Sharak, Gazipur, Vogra",Gazipur,Vogra,2016,Clean
"Fatullah Apparels",Knit,5,200,106,200000,"T-Shirts ,Polo Shirts","Post Office Road, Narayanganj, Fatullah",Narayanganj,Fatullah,2012,Clean
"Fatullah Dyeing & Calendering Mills Ltd.",Knit,5,392,195,166667,"Kids Items ,Trousers ,T-Shirts ,Polo Shirts","Post Office Road, Narayanganj, Fatullah",Narayanganj,Fatullah,1995,Clean
"Fatullah Fabrics Ltd.",Knit,1,298,258,182000,"T-Shirt ,Polo Shirt","Post Office Road, Fatullah, Narayangonj, Narayangonj",Narayanganj,Narayanganj,2022,Clean
"Favourite Garments Ltd.",Woven,5,417,196,72000,"Ladies Blouses ,Infants Wears ,Skirts ,Dresses","Kalma # 1, Dhaka, Savar",Dhaka,Savar,1985,Clean
"Favourite Knit Wears Ltd.",Knit,5,340,134,156000,"Shirts ,Pants ,T-Shirts ,Polo Shirts","Barabo, Tarabo, Narayanganj, Rupganj",Narayanganj,Rupganj,2014,Clean
"Fawn Wear Ltd.",Sweater,5,350,300,30000,"Sweaters ,Pullovers ,Cardigans","39, Kuturia, Dhaka, Savar",Dhaka,Savar,2003,Clean
"Fay-Max Sweater Composite Ltd.",Sweater,5,145,250,130000,Sweater,"Nowpara, Narsingdi, Madhabdi",Narsingdi,Madhabdi,2015,Clean
"FB Excellence Fashion Co. Ltd.",Woven,5,230,288,200000,"Shirts ,Pants","Lucky Plaza, Shimultala, Ashulia, Dhaka, Savar",Dhaka,Savar,2010,Clean
"FCI (BD) Limited",Woven,5,2600,1500,50000,"Blouse ,Blazers ,Skirts ,Trousers","Plot # 36-39, DEPZ, Ganakbari, Savar, Dhaka, Dhaka",Dhaka,Dhaka,1998,Clean
"Federal Garments Ltd.",Woven,5,300,200,40000,"Pant ,Ladies Shirts ,Short/Long Pants ,Trousers","Haji Abdus Samad Super Market (4th Fl), 123/1/A, South Jatrabari, Dhaka, Dhaka",Dhaka,Dhaka,1992,Clean
"Feiyue Fashions Ltd.",Knit,5,390,180,100000,"T-Shirts ,Polo Shirts ,Ladies Wear","S.A. Plot # 47, Technagapara, Gazipur, Chandana",Gazipur,Chandana,2007,Clean
"Fergasam (Bangladesh) Ltd.",Woven,5,400,430,0,"Shirts ,Jackets ,Pants","SFB, SF-3 (1st - 3rd floor), Chittagong, CEPZ",Chittagong,CEPZ,2008,Anomaly
"Feroja Apparels",Knit,5,320,135,0,"Trousers ,T-Shirts ,Polo Shirts ,Boxers","177/1, 178, South Bishil, Section # 1, Dhaka, Mirpur",Dhaka,Mirpur,2007,Anomaly
"Feroza Garments Ltd.",Woven,5,693,324,80000,"Shirts ,Pants ,Trousers ,Shorts","Sultan Mansion, 3, Sujat Nagar, Section # 12, Dhaka, Mirpur",Dhaka,Mirpur,1993,Clean
